{
  "id": 42,
  "name": "example-project",
  "description": "example_value",
  "path": "my-group/my-project",
  "path_with_namespace": "example-project",
  "name_with_namespace": "example-project",
  "visibility": "internal",
  "web_url": "https://gitlab.com/example",
  "http_url_to_repo": "https://gitlab.com/example",
  "ssh_url_to_repo": "https://gitlab.com/example"
}